{
  "agentCandidateCalls": 12,
  "artifactVersion": "s12.f-rf.internal-poc-candidate.v4",
  "candidateDigest": "sha256:1f33496ac57a1acf3fb21e7e2e6d3da039b582026858a3e238e7af849c9d1ca6",
  "candidateModel": "gpt-5.6-luna",
  "goldIncluded": false,
  "heldOutInspection": false,
  "nonClaims": [
    "candidate outputs are frozen for primary-agent proxy review only",
    "no scoring, review, acceptance, external validation, or human-quality claim",
    "no provider calls, held-out inspection, production enablement, selection, promotion, or release"
  ],
  "payloadDigest": "sha256:a2b66010f80ce7a885361415d8bc53e49014fcf347c32f4e385c3d5b238a7a33",
  "payloadPath": "evaluation/sprint-12/internal-poc/s12-f-rf-blinded-source-payload.v4.json",
  "priorReviewsIncluded": false,
  "priorScoresIncluded": false,
  "providerCalls": 0,
  "rawSensitiveDataIncluded": false,
  "reasoning": "high",
  "records": [
    {
      "caseId": "s12-a-4003",
      "language": "mixed",
      "response": {
        "abstentionReason": null,
        "entities": [
          {
            "candidateId": "poc-v4-01-01",
            "confidence": "0.70",
            "evidence": {
              "endOffset": 14,
              "startOffset": 0,
              "text": "dispatch board"
            },
            "label": "dispatch board",
            "type": "Task"
          },
          {
            "candidateId": "poc-v4-01-02",
            "confidence": "0.70",
            "evidence": {
              "endOffset": 43,
              "startOffset": 29,
              "text": "routing window"
            },
            "label": "routing window",
            "type": "Risk"
          },
          {
            "candidateId": "poc-v4-01-03",
            "confidence": "0.70",
            "evidence": {
              "endOffset": 81,
              "startOffset": 68,
              "text": "cargo-routing"
            },
            "label": "cargo-routing",
            "type": "Task"
          }
        ],
        "links": [],
        "modelId": "gpt-5.6-luna",
        "modelVersion": "internal-poc-v4",
        "relations": [
          {
            "confidence": "0.62",
            "evidence": {
              "endOffset": 82,
              "startOffset": 0,
              "text": "dispatch board worker hỗ trợ routing window nhưng vẫn answers trong cargo-routing."
            },
            "predicate": "supports",
            "sourceEntityId": "poc-v4-01-01",
            "targetEntityId": "poc-v4-01-03"
          }
        ],
        "schemaVersion": "m3.v2",
        "usage": null
      },
      "responseDigest": "sha256:027503a9b45b6ddaf944115a4d07192c1fb9e11a6c2cd7a4d082a2ee17149bcf",
      "scenarioId": "s12-s-201",
      "sourceDigest": "sha256:ceac4d3218a8dc949b699d137557b6ffb417bd5bbcd17abfba5dedae77a15bf3",
      "sourceVersion": {
        "canonicalContentDigest": "sha256:ceac4d3218a8dc949b699d137557b6ffb417bd5bbcd17abfba5dedae77a15bf3",
        "canonicalizationVersion": "crlf-lf.v1",
        "contractVersion": "source-version.v1",
        "coordinateSystemVersion": "unicode-codepoint.v1",
        "originalContentDigest": "sha256:ceac4d3218a8dc949b699d137557b6ffb417bd5bbcd17abfba5dedae77a15bf3",
        "parentCanonicalContentDigest": null,
        "parentSourceVersionId": null,
        "projectScopeId": "project_bc43fd61c7053ea65a807265af2550b5da91063aaef9231afc7b173132c3509e",
        "receiptDigest": "sha256:c2bc078c53b7bdbc9629579c04a6856a4a590a491735d8e4538bd22e174c6eff",
        "replayKey": "replay_945b7865d13346115dfe52be879526e57251c5f7478e687d8ffdebfe2e0240a3",
        "retention": {
          "expiresOn": null,
          "policy": "until-unreferenced"
        },
        "sourceArtifactScopeId": "artifact_670b67e517263d0c08b7180913f58349187d3c35c89e143e980d6fb9e8087941",
        "sourceVersionId": "sv_945b7865d13346115dfe52be879526e57251c5f7478e687d8ffdebfe2e0240a3"
      }
    },
    {
      "caseId": "s12-a-4019",
      "language": "mixed",
      "response": {
        "abstentionReason": null,
        "entities": [
          {
            "candidateId": "poc-v4-02-01",
            "confidence": "0.70",
            "evidence": {
              "endOffset": 12,
              "startOffset": 0,
              "text": "roster board"
            },
            "label": "roster board",
            "type": "Task"
          },
          {
            "candidateId": "poc-v4-02-02",
            "confidence": "0.70",
            "evidence": {
              "endOffset": 39,
              "startOffset": 27,
              "text": "coverage gap"
            },
            "label": "coverage gap",
            "type": "Risk"
          },
          {
            "candidateId": "poc-v4-02-03",
            "confidence": "0.70",
            "evidence": {
              "endOffset": 82,
              "startOffset": 67,
              "text": "roster-planning"
            },
            "label": "roster-planning",
            "type": "Task"
          }
        ],
        "links": [],
        "modelId": "gpt-5.6-luna",
        "modelVersion": "internal-poc-v4",
        "relations": [
          {
            "confidence": "0.62",
            "evidence": {
              "endOffset": 83,
              "startOffset": 0,
              "text": "roster board worker hỗ trợ coverage gap nhưng vẫn implements trong roster-planning."
            },
            "predicate": "implements",
            "sourceEntityId": "poc-v4-02-01",
            "targetEntityId": "poc-v4-02-03"
          }
        ],
        "schemaVersion": "m3.v2",
        "usage": null
      },
      "responseDigest": "sha256:30f07668cdb3d68ef966e72417e304408b729829619c0f0a669d7fbe3a2d7d0a",
      "scenarioId": "s12-s-203",
      "sourceDigest": "sha256:74350d831e679ae2ed71e72dc58cee1ac222ab27428deab90e1cb771706b5e51",
      "sourceVersion": {
        "canonicalContentDigest": "sha256:74350d831e679ae2ed71e72dc58cee1ac222ab27428deab90e1cb771706b5e51",
        "canonicalizationVersion": "crlf-lf.v1",
        "contractVersion": "source-version.v1",
        "coordinateSystemVersion": "unicode-codepoint.v1",
        "originalContentDigest": "sha256:74350d831e679ae2ed71e72dc58cee1ac222ab27428deab90e1cb771706b5e51",
        "parentCanonicalContentDigest": null,
        "parentSourceVersionId": null,
        "projectScopeId": "project_bc43fd61c7053ea65a807265af2550b5da91063aaef9231afc7b173132c3509e",
        "receiptDigest": "sha256:7f14f15299f66db7c5a519f60129d28c83c5a150bb42152633ce519123b3221e",
        "replayKey": "replay_0b0fb88dce03d45890cf417836d9fcb183d91a992a93aac9a0ebb08c4513973e",
        "retention": {
          "expiresOn": null,
          "policy": "until-unreferenced"
        },
        "sourceArtifactScopeId": "artifact_a8901d6a31f79f5e6d488c6f78d5dfe6edc4e5cf10a617aca7a866495376c1e4",
        "sourceVersionId": "sv_0b0fb88dce03d45890cf417836d9fcb183d91a992a93aac9a0ebb08c4513973e"
      }
    },
    {
      "caseId": "s12-a-4027",
      "language": "mixed",
      "response": {
        "abstentionReason": null,
        "entities": [
          {
            "candidateId": "poc-v4-03-01",
            "confidence": "0.70",
            "evidence": {
              "endOffset": 14,
              "startOffset": 0,
              "text": "settlement job"
            },
            "label": "settlement job",
            "type": "Task"
          },
          {
            "candidateId": "poc-v4-03-02",
            "confidence": "0.70",
            "evidence": {
              "endOffset": 42,
              "startOffset": 29,
              "text": "refund window"
            },
            "label": "refund window",
            "type": "Risk"
          },
          {
            "candidateId": "poc-v4-03-03",
            "confidence": "0.70",
            "evidence": {
              "endOffset": 79,
              "startOffset": 66,
              "text": "mobile-wallet"
            },
            "label": "mobile-wallet",
            "type": "Task"
          }
        ],
        "links": [],
        "modelId": "gpt-5.6-luna",
        "modelVersion": "internal-poc-v4",
        "relations": [
          {
            "confidence": "0.62",
            "evidence": {
              "endOffset": 80,
              "startOffset": 0,
              "text": "settlement job worker hỗ trợ refund window nhưng vẫn blocks trong mobile-wallet."
            },
            "predicate": "blocks",
            "sourceEntityId": "poc-v4-03-01",
            "targetEntityId": "poc-v4-03-03"
          }
        ],
        "schemaVersion": "m3.v2",
        "usage": null
      },
      "responseDigest": "sha256:45a429cbed0b20161ae6f489562b9f5c222c0a312317df7fa500e5cc9789c18f",
      "scenarioId": "s12-s-204",
      "sourceDigest": "sha256:c0ff029ea67d168de0bec5c47e9c9b5173c636c7b60aecef84eb23d73202ce5e",
      "sourceVersion": {
        "canonicalContentDigest": "sha256:c0ff029ea67d168de0bec5c47e9c9b5173c636c7b60aecef84eb23d73202ce5e",
        "canonicalizationVersion": "crlf-lf.v1",
        "contractVersion": "source-version.v1",
        "coordinateSystemVersion": "unicode-codepoint.v1",
        "originalContentDigest": "sha256:c0ff029ea67d168de0bec5c47e9c9b5173c636c7b60aecef84eb23d73202ce5e",
        "parentCanonicalContentDigest": null,
        "parentSourceVersionId": null,
        "projectScopeId": "project_bc43fd61c7053ea65a807265af2550b5da91063aaef9231afc7b173132c3509e",
        "receiptDigest": "sha256:1a25c8f6bd1b2dccc1477582626dff3a5562c2cb5d3093ea8db4d9a63e77395a",
        "replayKey": "replay_7b2d2be04a5a6ca2b66bdaf45aaa97347266eea96c5f1ae4cf477c293a378ee3",
        "retention": {
          "expiresOn": null,
          "policy": "until-unreferenced"
        },
        "sourceArtifactScopeId": "artifact_f1885cc1bcf1e9e5c85443e9f7a166ee6fbc8e520364a871f83a9558c858bfaf",
        "sourceVersionId": "sv_7b2d2be04a5a6ca2b66bdaf45aaa97347266eea96c5f1ae4cf477c293a378ee3"
      }
    },
    {
      "caseId": "s12-a-4035",